Description,Eligibility,FO Reference,GO ID,Primary Category,Secondary Category,Title
"Festivals Australia provides funding to support individual art projects at festivals or significant one-off community events, such as a town’s centenary celebration or opening of a major new community resource. 
 Festivals Australia will: 
 • provide access to a diverse range of high quality, innovative arts projects that grow audiences at festivals across regional Australia 
 • support partnerships and collaboration across the arts sector 
 • encourage community participation in arts projects at regional and remote festivals. 
 The program delivers two funding rounds each year usually opening in February and September. The Minister for Communications,Cyber Safety and the Arts(or his delegate) approves funding under the Program Guidelines. 
 There is no limit to the amount of funding that may be sought, however the average funding request is around $40,000. Only one project, per organisation, per festival will be funded. 
 Funding is available through annual or multi-year funding agreements subject to available funds. Multi-year funding is only available to support the development and delivery of a single project across financial years.","To be eligible for funding, applicants must:  • be an Australian incorporated organisation* • have an active Australian Business Number (ABN) • be registered for the Goods and Services Tax (GST), if required by the Australian Tax Office, and • not have any outstanding reports, acquittals or serious breaches relating to any Commonwealth funding.  * Applicants from the Australian external territories, such as Norfolk Island, are eligible to apply. Unincorporated groups are eligible for funding but must be auspiced by an organisation that meets the above criteria. Festivals Australia does not fund projects in major cities or metropolitan locations. ",Festivals-R11-2020,GO4358,121006 - Performing Arts,141000 - Community Development,Festivals Australia
"The purpose of the grant is twofold. One is to support the development and distribution of the Prevention of Elder Abuse Learning Package. The package will consist of 33 online learning modules aimed at health and allied health professionals to identify and prevent elder abuse, including sexual abuse. 
 The second purpose is support the Staying Supproted and Connected in Your Community Project. The project will leverage off the second series of the ABC’s  Old People’s Home for 4 year Olds  to strengthen intergenerational relationships in the community and connect people to services and supports. 
 To view the Grant Opportunity Guidelines, please select the red ""GO Documents"" button on the left hand side.","To be eligible for this grant opportunity you must be the listed invited organisation below and have received an invitation to apply. If the potential grantee does not satisfy the eligibility criteria, it will not be considered. 
 Eligible Organisation:  Older Persons Advocacy Network LTD (ABN: 81 618 261 859)",,GO4743,101001 - Aged Care,,Elder Abuse Prevention Education Package for Health Professionals andStaying Supported & Connected in Your Community
"CRC-P grants support short term industry-led collaborations to develop important new technologies, products and services. CRC-Ps solve industry problems and deliver tangible outcomes. 
 CRC-P grants aim to: 
 
 improve the competitiveness, productivity and sustainability of Australian industries, especially where Australia has a competitive strength solve industry problems and deliver tangible outcomes. 
 deliver outcomes in line with government priorities 
 encourage and enable small and medium enterprise (SME) participation in collaborative research 
 foster high quality research to help solve industry specific problems through collaborative research partnerships between industry entities and research organisations. 
","Collaborations from industry, research and community sectors can apply. A lead participant (that is an industry entity) must submit the application. A CRC-P application must have among its participants at least: two Australian industry organisations (including one SME) one publicly funded Australian research organisation. Applicants must demonstrate the ability to at least match (in cash or in-kind) the level of CRC Programme Funding requested and provided.",,GO116,261001 - Industry Innovation,,Cooperative Research Centres Projects (CRC-P) grants
"Applications to this grant opportunity must propose a clinical trial that addresses a gap in current research and/or knowledge in rare cancers, rare diseases and areas of unmet medical need.  
 Applications must address the desired outcomes described in section 1.3 of the grant guidelines. ","Applications will only be accepted from NHMRC approved Administering Institutions. A list of NHMRC approved Administering Institutions is available on GrantConnect and on the NHMRC website:  https://nhmrc.gov.au/funding/manage-your-funding/nhmrcs-administering-institutions Applications must satisfy all the requirements set out in the 2019 Rare Cancers, Rare Diseases and Unmet Need Grant Opportunity Guideline.",,GO4318,231013 - Medical Research,,"MRFF Clinical Trials Activity Initiative – 2020 Rare Cancers, Rare Diseases and Unmet Need General Grant Opportunity"
"The Discovery Indigenous (IN) grant opportunity is a separate element of the Discovery Program. The IN grant opportunity provides project funding for research projects led by an Aboriginal and Torres Strait Islander researcher.  
 The objectives of the Discovery Indigenous grant opportunity are to:  
 
 support excellent basic and applied research and research training by Aboriginal and Torres Strait Islander researchers as individuals and as teams 
 develop the research expertise of Aboriginal and Torres Strait Islander researchers 
 support and retain established Aboriginal and Torres Strait Islander researchers in Australian higher education institutions 
 expand Australia’s knowledge base and research capability 
","An application may only be submitted through the Research Office of an Eligible Organisation listed in the Grant Guidelines. To be eligible, a Discovery Indigenous application must nominate at least one Chief Investigator (CI) or a Discovery Aboriginal and Torres Strait Island Award (DAATSIA) candidate. The first-named CI must be an Aboriginal and Torres Strait Islander researcher and will be the Project Leader.  To be eligible to apply as a DAATSIA candidate, the individual nominated must be an Aboriginal and Torres Strait Islander researcher; as at the grant opportunity closing date not be nominated for more than one DAATSIA in any given year. An individual who has previously been awarded a DAATSIA may apply for another DAATSIA, but can only hold one at a time. To be eligible to apply as a CI, DAATSIA candidate or Partner Investigator (PI), the individual nominated must as at the grant opportunity closing date: have met their obligations regarding previously funded projects, including submission to the ARC of satisfactory final reports.  To be eligible to hold, the CI or DAATSIA candidate must meet at least one of the following criteria: be an employee for at least 20 per cent of full time equivalent (0.2 FTE) at an Eligible Organisation; or be a holder of an honorary academic appointment at an Eligible Organisation; a CI must reside predominately in Australia for the project activity period; a CI must not be undertaking a Higher Degree by Research (HDR) during the project activity period. For details on limits, please refer to the Grant Guidelines for the Discovery Program (2018).  To be eligible to apply as a PI the individual nominated must at the grant commencement date: not be eligible to be a CI. To be eligible to hold, the PI: must not meet the eligibility criteria for a Chief Investigator during the project activity period; an employee of an Eligible Organisation who does not reside predominately in Australia may be a PI.",DProg2018,GO2021,"381002 - Humanities, Arts and Social Sciences (HASS) Research","381001 - Science, Technology, Engineering and Mathematics (STEM) Research",Discovery Indigenous for funding commencing in 2020
"The Australian Government is inviting applications under the Multicultural Affairs and Citizenship Program: Community Languages Multicultural Grants Stream Two in 2019-20.  
 The objective of the grant opportunity is to build the capacity of community language schools to deliver quality language education. The Community Language Multicultural Grants aims to: 
 
 Support the maintenance, development and acquisition of languages other than English. 
 
 Connect young Australians to the languages and cultures of their community. 
 
 
 Enhance cross-cultural awareness and respect for cultural diversity. 
 
 
 The Australian Government announced $10 million over two years for the Community Languages Multicultural Grants. Stream Two funding will provide up to $25,000 for a project grant to develop resources or training to benefit the community language sector more broadly.  
 Applications from organisations applying as a consortium will be prioritised for funding. Applicants are encouraged to seek endorsement for their proposed project from either the national peak body or a state and territory peak body relating to community languages.","To be eligible you must be a not-for-profit community language school that is legally registered in Australia.  For the purpose of this grant opportunity, a community language is defined as a language other than English that is used on a day-to-day basis by members of cultural/linguistic groups residing in Australia.  For the purpose of this grant opportunity, a community language school is defined as a not-for-profit community organisation that holds community language classes outside of school hours with a minimum of two hours per week of instructor led language tuition for at least 35 weeks of the year using a teaching program. You must be one of the following legal entities to apply: Company Cooperative Incorporated Association Indigenous Corporation  Partnership Statutory entity Trustee on behalf of a Trust. As a not-for-profit organisation, you may be asked to demonstrate your not-for-profit status through one of the following: state or territory incorporated association registration number or certificate of incorporation, e.g. clubs and other associations current Australian Charities and Not for profits Commission’s (ACNC) registration, e.g. for organisations registered as a charity. You must also have the following requirements in place before you apply for this grant opportunity:  An Australian Business Number (ABN) An account with an Australian financial institution.  ",FOCL2,GO3603,161003 - Multiculturalism,,Community Languages Multicultural Grants - Stream Two
"ASIC’s MoneySmart Teaching program provides teachers with professional learning and classroom resources to support delivery of financial literacy education in the classroom. 
 This grant opportunity supports the above program by providing grants to suitable Principals of Primary Schools to carry out grant activities related to their respective Principal Project to build consumer and financial literacy and capabilities of primary school aged children as well as the broader school communities.","To be eligible you must be a natural person who is a principal of a primary school in an Australian State or Territory. Although under this grant opportunity, a grantee is a principal of a primary school, the ultimate beneficiaries of these grants are the primary school aged students and the broader community of that school. In the event a grantee (i.e. principal) departs a primary school, and there is a replacement or acting principal appointed for that school, then this individual must contact ASIC and APPA for a variation to or novation of the letter of agreement in accordance with section 10.4 of these guidelines to reflect this change of circumstance.      ",,GO1650,191005 - Primary and Secondary Schools,,Principals Project Grant - Round 1
"This program is part of the Australian Government's $200 million investment in bushfire recovery for native plants, animals, ecological communities and natural assets. This funding aims to support the recovery and long-term resilience of wildlife and their habitat. 
 The objective of this grant opportunity is to support Indigenous organisations, Indigenous businesses and Traditional Owners to lead workshops aimed at sharing and strengthening knowledge of Indigenous fire and land management practices. 
 There is a maximum of one application per organisation for this grant opportunity. 
 There is $2 million available for this grant opportunity. 
 The Minimum grant is $20,000. 
 The maximum grant is $200,000. 
 The grant amount will be up to 100 per cent of eligible project expenditure. 
 Your project must be delivered in partnership with local Traditional Owners. 
 You must complete your project by 1 April 2022.","To be eligible you must have an Australian business number (ABN) and be a Traditional Owner, Indigenous Organisation or Indigenous Enterprise and be one of the following entities: 
 
 an entity, incorporated in Australia 
 an Indigenous not-for-profit corporation, council or incorporated association 
 an Indigenous government agency or body 
 an incorporated trustee on behalf of a trust 
 
 We can only accept applications where: 
 
 you certify that your proposed project does not duplicate other government-funded management actions that are already underway in the location you are proposing to undertake activities 
 you certify that you do not have any overdue reports, acquittals or debt associated with previous Australian Government funding 
 
 Joint applications are acceptable, provided you have a lead organisation who is the main driver of the project and is eligible to apply. 
 Not eligible 
 You are not eligible to apply if you are: 
 
 a non-Indigenous organisation 
 an unincorporated association 
 any organisation not included in section 4.1 of the grant opportunity guidelines 
 a trust (however, an incorporated trustee may apply on behalf of a trust provided they meet the eligibility requirements as described in section 4.1 of the grant opportunity guidelines) 
 an individual 
 an Australian Commonwealth/State/Territory/Local Government agency or body (however, an Indigenous government agency or body may apply as per section 4.1 of the grant opportunity guidelines) 
",,GO4406,211006 - Natural Resources - Conservation and Protection,,Indigenous Fire and Land Management Workshops
"The Australian Government is inviting applications in an open process to apply for funding to deliver projects through the Advancing Pest Animal and Weed Control Solutions competitive grant round (2020 to 2023). 
","To be eligible you must: have an Australian Business Number (ABN) or Australian Company Number (ACN) be registered for the purposes of GST have an account with an Australian financial institution be an organisation with a proven research and development capacity target a nationally significant invasive established pest animal or weed (see section 2.2.3) be applying for a grant within the grant limits (between $300,000 and $2 million (GST exclusive) and grant period have a project that meets at least one of the grant program outcomes (see section 2.2.2) source additional cash and/or in-kind contributions towards the project have completed all application forms and templates (see section 6: The assessment criteria). To be eligible you must also be one of the following entity types: Indigenous Corporation Company Corporate Commonwealth Entity Non-Corporate Commonwealth Entity Non-Corporate Commonwealth Statutory Authority Commonwealth Company Corporate State or Territory Entity Non-corporate State or Territory Entity Non-corporate State or Territory Statutory Authority Local Government Cooperative Incorporated Association Sole Trader Statutory Entity Partnership Trustee on behalf of a Trust Unincorporated Association.  ",,GO4210,111004 - Rural Development,,Advancing Pest Animal and Weed Control Solutions
"COALAR’s Grant Round for 2021-2022 will open at 1600 AEST on Monday 19 July 2021 and will close at 1600 AEST Friday 10 September 2021.   
 The grant round will seek applications for projects that can be undertaken between the period: 1 March 2022 and 28 February 2023 in: Argentina, Australia, Brazil, Chile, Colombia, Costa Rica, Cuba, Ecuador, El Salvador, Guatemala, Mexico, Panama, Paraguay, Peru and Uruguay.  Note that projects must be underway by at least 30 June 2022 to meet funding requirements of the 2021-2022 budget. 
  ","To be eligible you must be  one  of the following entity types: 
 • an Australian entity with an Australian Business Number (ABN), Australian Company Number (ACN), or Indigenous Corporation Number (ICN) 
 • an Australian consortium with a lead organisation 
 • an Australian registered charity or not-for-profit organisation 
 • an Australian local government body 
 • an Australian State/Territory government body 
 • a corporate Commonwealth entity 
 • an Australian statutory authority 
 • an Australian or permanent resident of Australia 
 • a citizen or organisation from one of the following countries in Latin America: Argentina, Brazil, Chile, Colombia, Costa Rica, Cuba, Ecuador, El Salvador, Guatemala, México, Panamá, Paraguay, Perú and Uruguay 
 • a well-established organisation in a Latin American country with a business purpose to advocate for Australian business, education and/or cultural interests 
 • and be willing to provide or develop child protection guidelines that meets the  Child Protection Policy | Australian Government Department of Foreign Affairs and Trade (dfat.gov.au)  for your project if it involves people under the age of 18 years. 
 Applications from consortia are acceptable, provided you have a lead applicant who is the main driver of the project and is eligible as per the list above. 
  ",,GO4949,371004 - Public Diplomacy,,Coalar Grant Round 2021-22
"In the 2021-22 Budget, the Australian Government  committed $37.3 million for 4 years (2021-22 to 2024-25) to expand the Greater Choice for At Home Palliative Care Measure from 11 pilot PHN sites to a national program including all 31 PHN sites. 
 Of the total funding, $34.2 million will be provided to PHNs to develop innovative and targeted programs, at the local level, to improve awareness of local palliative care options and to coordinate and facilitate access to palliative care services at home. 
 PHN sites joining the GCfAHPC program will receive $150,000 in the first year (2021-22) to employ up to 1 full time equivalent person (FTE) to plan and develop their activities. From 2022-23, these PHNs will receive $300,000 per year for three years, until 2024-25, to employ up to 2 FTE to implement these activities. Existing GCfAHPC PHNs will continue to receive $300,000 per year to employ up to 2 FTE to further build on and expand the activities they have been implementing under the Measure. 
 To view the grant opportunity documents, please select the red ""GO Documents"" button on the left hand side.",PHNs,,GO5059,231016 - Palliative Care,,Primary Health Networks (PHNs) Program: Expansion of the Greater Choice for At Home Palliative Care (GCfAHPC) Measure
"The aim of the National Tax Clinics program is to provide funding to eligible tertiary education providers to operate an independent service, where unrepresented taxpayers can seek free tax assistance from students under the supervision of a qualified tax professional. The service is available to taxpayers who may not be able to use a tax practitioner due to economic, social or personal factors. There are no fixed criteria that will be applied to clients of the Tax Clinics; however, priority should be given to those persons considered vulnerable. Discretion will be given to the National Tax Clinics operator to select clients based upon their personal and financial circumstances while keeping within the aims of the program. 
  ",Please see attached Grant Opportunity Guidelines for eligibility criteria.,,GO4847,191008 - Vocational Education,,Australian Taxation Office National Tax Clinics Grant Program
"Festivals Australia provides funding to support individual art projects at festivals or significant one-off community events, such as a town’s centenary celebration or opening of a major new community resource. 
 Festivals Australia will: 
 • provide access to a diverse range of high quality, innovative arts projects that grow audiences at festivals across regional Australia 
 • support partnerships and collaboration across the arts sector 
 • encourage community participation in arts projects at regional and remote festivals. 
 The program delivers two funding rounds each year usually opening in February and September. The Minister for Communications, Urban Infrastructure, Cities and the Arts (or his delegate) approves funding under the Program Guidelines. 
 There is no limit to the amount of funding that may be sought, however the average funding request is around $40,000. Only one project, per organisation, per festival will be funded. 
 Funding is available through annual or multi-year funding agreements subject to available funds. Multi-year funding is only available to support the development and delivery of a single project across financial years.","To be eligible for funding, applicants must:  
 • be an Australian incorporated organisation* 
 • have an active Australian Business Number (ABN) 
 • be registered for the Goods and Services Tax (GST), if required by the Australian Tax Office, and 
 • not have any outstanding reports, acquittals or serious breaches relating to any Commonwealth funding. 
  * Applicants from the Australian external territories, such as Norfolk Island, are eligible to apply. 
 Unincorporated groups are eligible for funding but must be auspiced by an organisation that meets the above criteria. 
 Festivals Australia does not fund projects in major cities or metropolitan locations. ",,GO4681,121006 - Performing Arts,141000 - Community Development,Festivals Australia
"The Australian Government is inviting applications in an open competitive process to deliver activities under the Support for NDIS Providers Program through the NDIS Quality and Safeguards Commission.  
 The Support for NDIS Providers Program is a new four year grants program of up to $17.6 million from 2018-19 to 2021-22, for a national information and education program to develop and grow a quality market in the NDIS, emphasising compliance obligations through the lens of the people with disability accessing NDIS supports and services.   
 The objective of this grant opportunity is to support the transition of NDIS registered providers to meet new requirements set out in the  NDIS   Act 2013  and the  NDIS (Provider Registration and Practice Standard) Rules 2018. 
 It also aims to help those existing and prospective NDIS providers to enter and remain in the NDIS market who have a demonstrated commitment to supporting and promoting the rights, health, and wellbeing of people with disability participating in the NDIS.  
 This grant opportunity seeks applications to deliver innovative activities that will achieve the following outcomes: 
 -  NDIS providers understand their registration obligations and comply with them 
 -  NDIS providers demonstrate capacity to provide quality support and service provision to NDIS participants 
 -  Efficient costs for NDIS providers registered for the NDIS through readiness to undertake the registration application processes and to be assessed against relevant practice standards  
 -  An increase in the proportion of NDIS providers actively participating in the NDIS market and supporting NDIS participants in achieving their individual outcomes and goals",Please refer to section 4 of the Grant Opportunity Guidelines.,,GO2401,171004 - Services for People with Disabilities,,Support for NDIS Providers Program
