Description,Eligibility,FO Reference,GO ID,Primary Category,Secondary Category,Title
"The $20 million Australian 5G Innovation Initiative supports the Australian Government’s commitment to demonstrating the value of 5G to businesses in Australia. 
 For the Round 1 grant opportunity there is a total of $10 million available. 
 The grant opportunity: 
 • supports 5G trials that undertake rigorous, commercial, and replicable testing of 5G technology 
 • offers businesses the opportunity to identify 5G applications that demonstrate 5G’s capability 
 • supports various projects that demonstrate 5G’s capability and benefits across a range of industry sectors and locations. 
 More information on the Australian 5G Innovation Initiative including 5G benefits and access to spectrum can be found at  www.communications.gov.au/5Ginitiative","To be eligible you must: 
 
 have an Australian Business Number (ABN) 
 be registered for the Goods and Services Tax (GST). 
 
 You must be one of the following:  
 
 an entity, incorporated in Australia 
 a company limited by guarantee 
 an incorporated trustee on behalf of a trust 
 an incorporated not for profit organisation 
 a Local Government or State/Territory Government agency or body, where an application involves a partnership with at least one other eligible entity. 
 
 Joint applications are acceptable, provided you have a lead organisation who is the main driver of the project and is eligible to apply. For further information on joint applications, refer to section 7.2 of the grant opportunity guidelines. 
 To be eligible your project must: 
 
 conduct trials that undertake rigorous, commercial, and replicable testing of technologies that make use of 5G  
 identify solutions that demonstrate 5G’s capabilities. 
 
 Eligible activities must make use of at least one of the following core 5G capabilities: 
 
 enhanced mobile broadband  
 ultra reliable, low latency communications  
 massive machine-to-machine communications.  
 
 The definitions of the core capabilities are in the glossary at section 14 of the grant opportunity guidelines. ",,GO4596,321002 - Technology,,Australian 5G Innovation Initiative – Round 1
"The Skilling Australia’s Defence Industry Grants Program will provide grants to businesses over three years to help develop defence sector skills and human resources practices and training plans. 
 The program aims to: 
 
 reduce barriers faced by Small and Medium Enterprises (SMEs) in the defence sector when upskilling or retraining staff 
 develop skills within SMEs in the defence sector 
 support SMEs in the defence sector to establish human resources practices and training plans that will build lifelong learning activities into their business. 
","To be eligible you must: 
 
 have an Australian Business Number (ABN) 
 be non-income tax exempt (unless you are a defence industry association training your own staff or facilitating training to businesses you are representing). 
 
 and be one of the following entities: 
 
 an entity, incorporated in Australia 
 an incorporated trustee on behalf of a trust 
 
 We can only accept applications from: 
 
 SMEs with less than 200 employees that currently service, or intend to service, the defence industry sector and meet one of the following requirements:
 
 have a current Defence contract 
 be currently tendering or preparing to tender for a Defence contract 
 be a current subcontractor to a Defence prime or contracted through the Prime's supply chain to deliver on Defence projects. 
 
 
 Defence industry associations for training their own staff or for facilitating training to businesses they are representing. 
 
 You are not eligible to apply if you are: 
 
 income tax exempt (unless you are a defence industry association training your own staff or facilitating training to businesses you are representing) 
 an individual 
 a partnership 
 a trust (however, an incorporated trustee may apply on behalf of a trust) 
 a Commonwealth, State, Territory or local government body (including government business enterprises) 
 a non-corporate Commonwealth entity. 
",,GO4147,201002 - Employment Services,361002 - Defence,"Skilling Australia's Defence Industry Grants Program"
"As an initial contribution to implementing both the National Women’s Strategy and the National Men’s Strategy, the Australian Government’s health promotion grants program, will provide an opportunity for tailoring and extending national public awareness and health promotion initiatives in local and regional communities. 
 The objective of this grant opportunity is to support innovative approaches to trialling and evaluating local, regional, state wide or national health promotion initiatives focussing on improving health literacy, reducing risk and improving health and wellbeing within priority population groups (as identified in each Strategy). Priority will be given to initiatives that target populations to address clear unmet health and wellbeing needs. 
 The intended outcomes of the grant opportunity are: 
 • improved health literacy among priority population groups, including increased understanding of risk and opportunities for improving health; and • increased understanding of mechanisms to improve health literacy among priority population groups, based on evaluation of projects.",To be eligible you must satisfy the criteria in section 4.1 of the grant opportunity guidelines.,,GO2745,231012 - Health Promotion and Prevention Programs,,"National Women's Health Strategy and National Men's Health Strategy – Health Promotion"
"The $50 million Manufacturing Modernisation Fund supports manufacturers to modernise, adopt new technologies, become more productive and create more jobs by co-funding capital investments and associated reskilling. 
 Modernisation can include technology upgrades, efficiency upgrades, such as energy or process optimisation, or more transformative changes to your business, which will allow you to produce new products or diversify into new markets. 
 The program aims to:  
 
 
 support investment in efficient and transformative manufacturing processes by small and medium sized enterprises (SMEs) 
 
 
 support jobs growth and a more highly skilled workforce in the manufacturing sector 
 
 
 The program will run over 3 years and will be delivered through two streams of funding:  
 
 
 an estimated $20 million for matched grants of between  $50,000 to $100,000 for small scale  technology and efficiency investments 
 
 
 an estimated $30 million for larger grants between $100,000 to $1 million, on a three to one funding basis,  to support transformative investments in technologies and processes 
 
 
 The maximum grant period is 2 years.",To be eligible you must:  be an entity incorporated in Australia engage in trading activities that: Form a sufficiently significant proportion of its overall activities; or Are a substantial and not merely peripheral activity of the corporation You must also: be a manufacturing small and medium-sized enterprises (SMEs) with up to 199 employees (headcount) clearly identify the level of job creation expected provide evidence from your board that the project is supported and you can complete the project and meet the costs of the project not covered by grant funding For more information on eligibility please refer to the grant opportunity guidelines.,,GO2900,261001 - Industry Innovation,,Manufacturing Modernisation Fund
"The Australian Government is inviting applications via a targeted competitive process to apply for funding under the Regional Agricultural Show Development Grants Program (the program).  
 Funding will be available to eligible regional show societies for the maintenance and upgrade of existing infrastructure and the building, purchase, rent or construction of new infrastructure related to the running of an agricultural show on regional showgrounds. 
 The objectives of the program are to help: 
 a) keep agricultural shows running 
 b) bring communities together 
 c) bridge the divide between country and city. 
 Outcomes from the program are expected to include: 
 a) improved amenity of showground infrastructure to improve the experience of showground users and visitors. The amenities can include but are not limited to, for example, new and/or improved exhibiting and seating facilities, upgrading existing buildings to meet contemporary accessibility standards, building new or upgrading existing roads and buildings.  
 b) improved flexibility of use of showground infrastructure to increase the opportunity for it to be used for other events that bring the community together through the year.  
 c) use of modern construction methods and materials that reduce on-going maintenance and repair of infrastructure. 
 d) reduced operational costs for events conducted at and using showground facilities. 
 e) greater variety of attractions to improve shows’ ability to attract visitors.","There are three key eligibility criteria that applicants must satisfy. 1. You must be one of the following entity types: Indigenous Corporation Company Cooperative Incorporated Association Statutory Entity Partnership Unincorporated Association. If you are applying as a Trustee on behalf of a Trust, the Trustee must have an eligible entity type as listed above. 2. You must be a regional agricultural show society who is: a member of Agricultural Shows Australia (ASA) a member of a state and territory regional agricultural show society that is a member of ASA a regional agricultural show society intending to become a member of ASA or a state and territory regional agricultural show society that is a member of ASA. 3. You must be able to meet the following conditions: a) The regional agricultural show society must conduct a regular agricultural show at a showground located in a defined regional area (note: special consideration may be given if a regular agricultural show was not held in 2017, 2018 or 2019 owing to exceptional circumstances, but it is intended a show will be held in 2020 and/or subsequent years). b) The regional agricultural show society can provide evidence that the entity with responsibility for the relevant showground and related showground infrastructure affected by the proposed project supports the application. The responsible entity may be, for example, a trust or other constituted body responsible for the management of Crown land, a local council, or a user or tenant of the showground. ASA member state peak bodies representing regional agricultural shows are eligible to apply for state-wide grants for infrastructure or related projects. Applications must provide evidence that the grant funding and co-contributions will be used to benefit regional agricultural shows and show societies. In addition, you must also have an ABN, be registered for GST and have a bank account with an Australian financial institution. ",,GO3044,111004 - Rural Development,,Regional Agricultural Show Development Grants Program
"The Indigenous Contemporary Music program supports Aboriginal and Torres Strait Islander musicians and bands. It provides opportunities and skills to develop ongoing income and employment pathways in the music industry. 
 The program will fund Indigenous-led organisations who provide professional industry-based opportunities for Aboriginal and Torres Strait Islander musicians and bands. To receive funding under this program, an organisation must:  
 
 be fully or partially owned, governed, staffed or advised by Aboriginal and/or Torres Strait Islander people 
 have a history of good governance and sound financial management over an extended period, and 
 have capacity and expertise to design and deliver a development program for Aboriginal and Torres Strait Islander musicians and bands. 
","To be eligible an organisation must: 
 • have an Australian Business Number (ABN) 
 • be permanently established in Australia 
 • have an account with an Australian financial institution 
 • comply with all regulatory, industry and legal requirements in relation to copyright, licensing and employment, 
   
 and be one of the following entity types: 
 • an Aboriginal and/or Torres Strait Islander Corporation registered under the Corporations (Aboriginal and /or Torres Strait Islander) Act 2006 
 • a company incorporated in Australia 
 • a company incorporated by guarantee 
 • an incorporated trustee on behalf of a trust 
 • an incorporated association 
 • a partnership 
 • a joint (consortia) application with a lead organisation  
 • an incorporated not-for-profit organisation 
 • an arts or cultural heritage unit of an Australian local, state or territory government body 
 • a sole trader with employees.",,GO4682,121003 - Humanities,,Indigenous Contemporary Music program
"The Medical Research Future Fund (MRFF) - Genomics Health Futures Mission aims to improve the lives of Australians by accelerating research that delivers more effective testing, diagnosis and treatment; facilitates the adoption of new interventions; and consolidates Australia’s international leadership in genomics. 
 The objective of this grant opportunity is provide grants of financial assistance to support Australian medical research and medical innovation projects that:  
 
 Stream 1 (Targeted Call for Research) : identify and diagnose novel - primarily monogenic or oligogenic - rare diseases and increase the genomic diagnostic rate towards 70% by 2025. 
 Stream 2 (Targeted Call for Research):  improve early detection and targeted treatment for the most common cancers to reduce the burden of disease. Research proposals in this stream must focus on one of the following topics:  - Topic A: discover clinically relevant biomarkers to improve early detection of common cancers  - Topic B: develop genomic tools and technologies to identify genetic predisposition to cancer and improve screening and targeted intervention  - Topic C: develop genomic screening tools for predictive disease modelling and to guide therapy. 
 Stream 3 (Targeted Call for Research):  promote diagnostic effectiveness and efficiency through better understanding of the impact of genetic variants through functional genomics by establishing a national functional genomics approach to enhance novel gene discoveries, increase diagnostic rates and enable disease modelling to support development of targeted therapies. All three Streams are intended to support large-scale interdisciplinary research. 
 
 This grant opportunity is being administered by NHMRC on behalf of the Australian Government Department of Health. 
 Further information on the Medical Research Future Fund is available from the  Department of Health website .","Applications will only be accepted from NHMRC approved Administering Institutions. A list of NHMRC approved Administering Institutions is available from the GrantConnect GO Documents and from the  NHMRC’s Administrating Institutions list  on the NHMRC website. 
 Applications must satisfy all the requirements set out in the Medical Research Future Fund (MRFF) – Genomics Health Futures Mission – 2020 Genomics Health Futures Mission Grant Opportunity Guidelines.",,GO4560,231013 - Medical Research,,MRFF - Genomics Health Futures Mission -2020 Genomics Health Futures Mission Grant Opportunity
"The objectives of the Development Grant scheme are:  
 
 to increase, facilitate and expedite the translation of health and medical research outcomes through to commercialisation, within a foreseeable timeframe 
 to support proof-of-concept research with a feasible commercialisation pathway and a high likelihood of producing protected IP 
 to provide a potential mechanism through which research outcomes can be progressed to a stage that makes them competitive to receive industry investment through other government schemes or from the private sector, and 
 to encourage collaboration between health research, the private sector and industry (domestic and international).  
 
 The intended outcomes of the Development Grant scheme are: 
 
 increased rates of translation of health and medical research into commercial outcomes, resulting in improved health and medical knowledge.  
","Applications will only be accepted from NHMRC approved Administering Institutions. A list of NHMRC approved Administering Institutions is available at:  https://www.nhmrc.gov.au/funding/manage-your-funding/nhmrcs-administering-institutions . 
 Applications must satisfy all the requirements set out in the Development Grants 2021 Guidelines. ",,GO4756,231013 - Medical Research,,NHMRC Development Grants 2021 for funding in 2022
"The Australian Government is inviting applications through a targeted competitive process to apply to deliver services under the International Education Support Outcome – Destination Australia Program from 2019-20 to 2022-23.  
 The objective of the grant opportunity is to attract and support international and domestic students to study in regional Australia, to grow and develop regional Australian tertiary education providers and offer students a high quality learning experience. The program will: 
 
 enhance regional and rural Australian education institutions through promoting activities that contribute to growth and sustainability 
 offer students from Australia and overseas the opportunity to undertake high quality education, training and research in, and to experience regional and rural Australia, and 
 ensure regions share in the benefits of our $35 billion international education sector. 
 
 The intended outcomes of the grant opportunity are: 
 
 international and domestic students receive Australian Government scholarships for studying in regional Australia  
 increased awareness of the benefits of living, studying and working in regional Australia. 
 
 The program will provide grants to eligible Australian tertiary education providers to allocate, administer and promote scholarships for international and domestic students studying in regional Australia. ","To be eligible for this grant opportunity, you must be an Australian tertiary education provider with an active registration who meets the following criteria: If applying for scholarships for domestic students you must be:  A Registered Training Organisation (RTO) registered with the Australian Skills Quality Authority (ASQA), Victorian Registration and Qualifications Authority (VRQA), or the Western Australian Training Accreditation Council (WA TAC).  You must have a registration status of Current or Current (Re-registration pending) at the time the grant opportunity opens.   AND/OR A Higher education provider registered with the Tertiary Education Quality Standards Agency (TEQSA). You must have a registration status of Registered or Ongoing pending renewal at the time the grant opportunity opens.   If applying for scholarships for international students, in addition to the eligibility listed above, you must be:   A tertiary provider registered under the Commonwealth Register of Institutions and Courses for Overseas Students (CRICOS). You must have a registration status of Registered at the time the grant opportunity opens. Applicants will be required to provide their relevant registration ID/s within the application form. All  applicants must also meet the eligibility requirements listed below:  Tertiary education providers must have a campus location in a regional area as defined by the  Australian Statistical Geography Standard Remoteness Structure  from the Australian Bureau of Statistics which is defined as: inner regional outer regional remote or very remote. Tertiary education providers must only offer and administer scholarships through the Destination Australia Program to students studying at a regional campus and living in a regional or remote area. Please refer to the Grant Opportunity Guidelines for more information.",,GO2895,191002 - Higher Education,191008 - Vocational Education,Destination Australia Program
"Partnership Projects will support connections, within the Australian context, that translate research evidence into health policy and health practice, to improve health services and processes. 
 
 meet the need for a more effective integration of research evidence into health policy and service delivery 
 create partnerships among policy makers, managers, service providers and researchers  
 provide support to answer often complex and difficult questions that policy makers, managers and service providers face when making decisions and implementing policies that affect Australians health and health care  
 be highly responsive to the priorities of government, the community and health professionals 
 enable applicants to apply for funding at any time during the year to allow researchers and Partner Organisations to develop timely collaborations. 
",Applications for NHMRC funding are subject to the eligibility requirements set out in the Partnership Projects 2020 Guidelines.  Institutions must be an NHMRC approved Administering Institution to be eligible to receive and administer NHMRC funding – refer to the NHMRC for a list of approved Administering Institutions. ,,GO3862,231013 - Medical Research,,NHMRC Partnership Projects 2020
"The Australian Government is inviting applications for projects to deliver services under the National Landcare Program – Smart Farms Small Grants Round 4. 
 Smart Farms Small Grants is an open, competitive, grant opportunity to support projects to increase farming, forestry and fishing communities’ awareness, knowledge, skills and capacity to adopt best practice sustainable agriculture. 
 The purpose of Smart Farms Small Grants is to support land manager practice change that will deliver more sustainable, productive and profitable food, fibre and forestry business while protecting Australia’s biodiversity; protecting and improving the condition of natural resources; and assisting Australia meet its international obligations. 
 The purpose will be achieved by supporting projects that contribute to achieving one or both of the program outcomes outlined below: 
 
 
 Outcome 1 – Increased adoption of best practice sustainable agriculture 
 
 
 Outcome 2 – Increase the capacity of land managers to adopt best practice sustainable agriculture 
 
 
 A total of $43.5 million (GST exclusive) is available for Smart Farms Small Grants over six years (2017–18 to 2022–23).  
 
 
 The first round opened for applications in October 2017 from which, the then Minister for Agriculture and Water Resources approved 77 projects totalling $4.75 million (GST exclusive).  
 
 
 The second round opened for applications in November 2018 from which the then Minister for Agriculture approved 110 projects totalling $9.246 million (GST exclusive). 
 
 
 The third round opened for applications in October 2019 from which the Minister for Agriculture, Drought and Emergency Management approved 113 projects totalling $5.03 million (GST exclusive). 
 
 
 This grant opportunity is the fourth round. 
 
","To be eligible to apply for a grant you  must  be an individual or an organisation capable of entering into a legally binding and enforceable agreement with the Commonwealth. To be eligible you must be one of the following entity types: Commonwealth Company Company Cooperative Corporate Commonwealth Entity Corporate State or Territory Entity Incorporated Association Indigenous Corporation International Entity Local Government Non-corporate State or Territory Entity Non-corporate State or Territory Statutory Authority Partnership Person Sole Trader Statutory Entity Trustee on behalf of a Trust. Applications from consortia are eligible, as long as you have a lead applicant who is solely accountable to the Commonwealth for the delivery of grant activities and who is an eligible entity as per the list above. Eligible organisations can form a consortium with ineligible organisations.",,GO4255,111003 - Farming,211006 - Natural Resources - Conservation and Protection,National Landcare Program: Smart Farms Small Grants Round 4
