Description,Eligibility,FO Reference,GO ID,Primary Category,Secondary Category,Title
"Accelerating Commercialisation provides expert guidance and support to help you commercialise novel products, processes and services and find a commercialisation solution that is right for you. 
 Accelerating Commercialisation includes: 
 
 Commercialisation Guidance – guidance and assistance to develop the commercialisation potential of your novel product, process or service 
 Accelerating Commercialisation Grants – financial assistance to help commercialise your novel product, process and service. 
 
 Commercialisation Guidance 
 When you apply for Commercialisation Guidance, we connect you to an AusIndustry Customer Service Manager or an Accelerating Commercialisation Facilitator. Advice and support provided is tailored to your business situation and the commercialisation potential of your novel product, process or service, and may include: 
 
 initial guidance on commercialisation 
 referral to other government assistance to support your business needs 
 feedback if you want to apply for an Accelerating Commercialisation Grant 
 more intensive support and guidance to develop your commercialisation strategy 
 
 Accelerating Commercialisation Grant 
 Accelerating Commercialisation Grants provide up to 50% of eligible expenditure to support your commercialisation project. If successful you will receive on-going support from your Facilitator throughout the life of your commercialisation project. 
 You must receive Commercialisation Guidance before you apply for an Accelerating Commercialisation Grant.","Commercialisation Guidance To be suitable to receive Commercialisation Guidance you must have a novel product, process or service that you wish to commercialise for trade in Australian and/or overseas markets. You must also meet the turnover test, which helps us target our advice and support to the businesses that need it most. Accelerating Commercialisation Grants Before you can apply for an Accelerating Commercialisation Grant you must have received Commercialisation Guidance. You must: be non-tax exempt be registered for GST be one of the following entities: a company incorporated in Australia and a trading corporation, where your trading activities: form a sufficiently significant proportion of the corporation’s overall activities as to merit it being described as a trading corporation are a substantial and not merely peripheral activity of the corporation a Research Commercialisation Entity or Eligible Partner Entity as defined in the grant opportunity guidelines and also: be undertaking an eligible project have the ownership, access or beneficial use of any intellectual property you need to undertake the commercialisation project provide evidence of your ability to fund at least 50 per cent of eligible project expenditure, such as funding strategy and a bank statement or loan agreement. You must also provide an Accountant Declaration that confirms your ability to fund the project meet the turnover test. Read the Grant Opportunity Guidelines for more information.",,GO110,261001 - Industry Innovation,,"Entrepreneurs' Programme - Accelerating Commercialisation"
"The Australian Government is inviting applications via an open and competitive process to apply to deliver services under the RFCS Program in the 12 predefined service regions from 2021–22 to 2023–24. Applicants may apply for more than one service region, including across different states. 
 The RFCS Program is an Australian Government initiative that provides free and independent financial counselling to eligible farmers, fishers, foresters and small related enterprises who are experiencing, or at risk of, financial hardship. 
 The vision for the 2021 to 2024 RFCS Program is to empower clients to take control of their financial situation and cultivate financially capable primary producers that are profitable, self-reliant and resilient. 
 The objectives of the RFCS Program are to: 
 
 transition clients out of financial crisis 
 improve clients’ business profitability or facilitate a dignified exit 
 improve clients’ financial well-being and resilience. 
 
 The overarching outcome of the program is that clients who engage with the service become financially self-reliant and their businesses are better prepared to deal with risks.","Applications are sought from eligible organisations or consortia.  
 To be eligible you must be a legal entity with an Australian Business Number (ABN), have or are able to create an account with an Australian financial institution and be capable of entering into a legally binding and enforceable grant agreement with the Commonwealth. 
 To be eligible you must be one of the following entity types: 
 
 
 Indigenous Corporation registered under the  Corporations (Aboriginal and Torres Strait Islander) Act 2006  (Cth)  
 
 
 Company incorporated under the  Corporations Act 2001  (Cth) 
 
 
 Cooperative 
 
 
 Incorporated Association  
 
 
 Unincorporated Association 
 
 
 Trustee on behalf of a Trust 
 
 Partnership. 
 
 Requirements for applications from consortia 
 The consortium must nominate a lead applicant who is solely accountable to the Commonwealth for the delivery of grant activities. The lead applicant must be an eligible entity as per the list above. Eligible organisations can form a consortium with ineligible organisations. 
 Requirements for applications from unincorporated associations 
 Unincorporated associations may apply, however, if successful for a grant, it will be mandatory to incorporate prior to entering into the grant agreement.",,GO4500,111004 - Rural Development,,2021 to 2024 Rural Financial Counselling Service Program
"The Government has announced on 15 October 2021 that the Sovereign Industrial Capability Priority Grant and Capability Improvement Grant programs have now closed for applications for the 2021-22 financial year. For more information  read the media release . 
 How it works 
 You need to contribute 30% of the eligible project value. 
 Project activities can include: 
 
 buying, leasing, constructing, installing or commissioning of capital equipment including specialist software to enhance cyber security 
 
 As they relate to the above activities, this can also include: 
 
 design, engineering and commissioning activities 
 workforce training and accreditations. 
 
 The Sovereign Industrial Capability Priorities are listed in the 2018 Defence industrial capability plan and the accompanying fact sheet. Defence reviews the priorities periodically and publishes updates on its website.","To be eligible your business must: 
 
 have fewer than 200 employees 
 have an Australian business number (ABN) 
 be a company incorporated in Australia or be an incorporated trustee on behalf of a trust 
 
 Also, you must: 
 
 provide evidence from your Board (or Chief Executive Officer or equivalent if there is no board) that the project is supported, and that you can complete the project and meet the costs of the project not covered by grant funding 
 provide an external accountant declaration form that confirms you can fund your share of the project costs 
 
 Who is excluded? 
 You are not eligible to apply if you are: 
 
 an individual 
 a partnership 
 a trust (but an incorporated trustee may apply on behalf of a trust) 
 a government body at any level (including government business enterprise) 
",,GO1837,361002 - Defence,261002 - Small Business,Sovereign Industrial Capability Priority Grants
"The Commonwealth Home Support Programme aims to support frail, older people aged 65 years and over (or aged 50 years and over for Aboriginal and Torres Strait Islander people) to live as independently as possible in their own homes and community for as long as they can and wish to do so.  
 On 2 April 2019, the Australian Government announced the extension of funding arrangements for the CHSP from 1 July 2020 to 30 June 2022. The objectives of this grant opportunity are to:  
 
 
 extend the funding arrangements of current CHSP service providers through to 30 June 2022; 
 
 
 provide continued support to over 900,000 CHSP clients currently receiving entry level in home aged care services; and 
 
 
 to vary the grant agreements of eligible CHSP providers to better reflect their performance and local service delivery demands.   
 
 
 Generally, CHSP providers’ level of funding will remain the same. However, the Department of Health will use the extension process to reduce the amount of funding offered to CHSP service providers that have a history of not spending all of their grant funds.","To be eligible for this grant opportunity, you must have an executed Whole of Government grant agreement with the Commonwealth to deliver CHSP services that is due to expire on 30 June 2020. The Department is aware that there may be a number of organisations that are new to the CHSP who were successful in the 2019-20 growth funding round (GO2783). These organisations will be eligible for this grant opportunity once their grant agreement with the Department is finalised and executed.  We cannot consider your suitability to receive a grant if you do not satisfy the eligibility criteria.",,GO2731,101001 - Aged Care,,Commonwealth Home Support Programme Extension 1 July 2020 – 30 June 2022
"The Regional Airports Program will improve the safety and accessibility of airports or aerodromes in regional areas of Australia by supporting critical air infrastructure that will: 
 
 improve the safety of aircraft, operators and passengers using regional airports or aerodromes 
 facilitate improved delivery of essential goods and services such as food supplies, health care and passenger air services 
 improve the connectivity of Australia’s regions to domestic and global market opportunities 
 meet the operational requirements of aeromedical and other emergency services in the region. 
 
 There is a total of $45 million available for this grant round. There will be other grant rounds and we will publish the opening and closing dates and any other relevant information on  business.gov.au  and  GrantConnect . 
 The minimum grant amount is $20,000. 
 The maximum grant amount is $5 million. 
 The grant amount will be up to 50 per cent of eligible project costs, unless you and a third party are both contributing to eligible project costs. In this case, the grant amount will be up to 33.3 per cent of eligible project costs.","To be eligible you must: have an Australian Business Number (ABN) be an owner and/or operator of an existing aerodrome or airport in a regional area in Australia.   and be one of the following entities: an entity incorporated in Australia (including incorporated trustees on behalf of a trust) an Australian local government agency or body as defined in appendix A an Australian State or Territory Government agency or body a corporate Commonwealth entity an Aboriginal and Torres Strait Islander Corporation registered under the  Corporations (Aboriginal and Torres Strait Islander) Act 2006 (Cth) . State agencies or other eligible entities may apply on behalf of aerodrome owners/operators. In such cases, the state agency or other eligible entity will be the lead applicant in a joint application and will be wholly responsible for the project, including administering, reporting and acquitting all project expenditure. Only the lead organisation can submit the application form and enter into a grant agreement with the Commonwealth. We can only accept applications where: the location of your aerodrome is identified as Inner Regional or Outer Regional as defined by the  2016 Australian Statistical Geographic Standard (ASGS) Remoteness Area the aerodrome or airport’s passenger throughput is below 250,000 passengers (from all flight types) per year you provide evidence from your board or Council (or chief executive officer or equivalent if there is no board) that the project is supported by the applicant organisation, and that the organisation is willing to accept responsibility to complete the project and meet the costs of the project not covered by grant funding.",,GO2986,351001 - Infrastructure,351003 - Transport,Regional Airports Program
"The Regional Tourism Bushfire Recovery (RTBR) Grants program is a $10 million program which has been drawn from the Bushfire Recovery Fund. The program is part of the Government’s $76 million tourism recovery package to protect jobs, small businesses and local economies by helping get tourists travelling into bushfire affected regions. 
 The program has two funding streams which, together, will support events, concerts, festivals and visitor attractions in fire affected regions to assist with recovery efforts and encourage international and domestic visitors to come back to the regions. 
 Stream 1 - Will support smaller-scale events (including the promotion of these events), concerts, festivals and/or other visitor attractions such as art installations and tourist walks. Applicants may apply for more than one grant in this stream, up to a total value of $30,000 per applicant. Applications will be assessed as they are received.",Applicants are Local Government Authorities and Regional Tourism Organisations operating in Local Government Areas activated by state or territory governments for Disaster Recovery Funding Arrangements (DRFA) assistance for the 2019-2020 fire season.,,GO3689,181000 - Disaster Relief,,Regional Tourism Bushfire Recovery Grants - Stream 1
"The Linkage Projects scheme supports projects which initiate or develop long term strategic research alliances to apply advanced knowledge to problems, acquire new knowledge and as a basis for securing commercial and other benefits of research. 
 To facilitate successful collaboration between higher education institutions and other parts of the innovation system, there will be three assessment rounds for Linkage Projects for funding applied for in 2021, and funding outcomes will be recommended to the Minister within six months of the application closing date for each round. Please refer to the Important Dates document for detailed information about the assessment round dates. 
 The Linkage Projects scheme objectives are to: 
 * support the development of long-term strategic research alliances between higher education organisations and industry and other research end-users, in order to apply advanced knowledge to problems; 
 * provide opportunities for internationally competitive research projects to be conducted in collaboration with organisations outside the higher education sector; and 
 * enhance the scale and focus of research in Australian Government priority areas. 
 The intended outcomes of the Linkage Projects scheme are: 
 * the growth of a national pool of world-class researchers to meet the needs of the broader Australian innovation system; and 
 * economic, commercial, environmental, social and/or cultural benefits for Australia.","An application may only be submitted through the Research Office of an Eligible Organisation listed in the Grant Guidelines. The application must nominate at least one Chief Investigator (CI); the first named CI will be the Project Leader. Additional CIs and Partner Investigators (PIs) may be nominated in the application. 
 To be eligible to apply as a CI or PI the individual nominated must as at application submission have met their obligations regarding previously funded projects, including submission to the ARC of satisfactory final reports. 
 A CI must meet at least one of the following criteria at the grant commencement date and for the project activity period:  be an employee for at least 20 per cent of full time equivalent (0.2 FTE) at an Eligible Organisation; or be a holder of an honorary academic appointment at an Eligible Organisation. 
 A CI must reside predominantly in Australia for the project activity period; and must not be undertaking a Higher Degree by Research (HDR) during the project activity period. 
 A named participant can apply for and be concurrently funded through the Linkage Program for a maximum of four Linkage Program projects (not including the Linkage Infrastructure, Equipment and Facilities scheme) as a CI or Director. Please refer to the Grant Guidelines for further details regarding this eligibility requirement. 
 Limits may be re-calculated as other grant opportunity announcements are made. 
 To be eligible to apply as a PI, the individual nominated must at the grant commencement date: not be eligible to be a CI. 
 To be eligible to hold, a PI: must not meet the eligibility criteria for a CI during the project activity period. An employee of an Eligible Organisation who does not reside predominantly in Australia may be a PI.",LP2020,GO4564,"381001 - Science, Technology, Engineering and Mathematics (STEM) Research","381002 - Humanities, Arts and Social Sciences (HASS) Research",Linkage Projects for funding applied for in 2021
"Saluting Their Service  Community Commemorative Grants (STS CCG) 
 The Community Commemorative Grants opportunity provides funding for community based commemorative activities that commemorate the involvement, service and sacrifice of Australia's service personnel in wars, conflicts and peace operations.",Company Cooperative Indigenous corporation Incorporated association Local government Sole Trader State/Territory Government entity Statutory entity Trustee on behalf of a Trust Unincorporated association  ,,GO1209,361003 - Veterans,361001 - Commemorative,Saluting Their Service Community Commemorative Grants
"The Safer Communities Fund provides grants of up to $1 million to community organisations and local governments for local crime prevention and security infrastructure activities and to protect community organisations that may be facing security risks associated with racial and /or religious intolerance. Project activities can include:  
 
 installation of fixed or mobile CCTV cameras 
 installation of security lighting 
 installation of bollards 
 installation of security and alarm systems, intercoms and swipe access attached to a public or community space 
 crime prevention through environmental design (CPTED) including changing environmental characteristics in public or community spaces, such as a lack of lighting or poor natural surveillance, that can facilitate street crime and violence.  
 
 Grants of up to $1 million will be available to fund up to 100 per cent of eligible project costs. 
 Projects must be completed by 31 March 2020.","To be eligible you must: have an Australian Business Number (ABN) and be one of the following entities: an incorporated  not for profit organisation a local government agency or body as defined in appendix A of the grant opportunity guidelines Industry/trader associations and chambers of commerce can apply if they meet the eligibility criteria above. In order to be eligible you must: provide evidence from the site owner or manager providing authority for you to undertake the project at the nominated site. You should use the letter template at the bottom of this page and provide this with your application or prior to entering into a grant agreement. be able to start your project within 8 weeks of executing a grant agreement which can include project planning activities. have met relevant state or territory legislation obligations related to working with children, and ensure that any person that has direct, unsupervised contact with children as part of a project under this program, has undertaken and passed a working with children check, if required under relevant State or Territory legislation. You are also responsible for assessing the suitability of the people you engage as part of your project to ensure children are kept safe. You are not eligible to apply if you are: a school or preschool that is registered as an educational establishment with a state or territory registration authority",,GO1549,151001 - Community Safety,331003 - Social Inclusion,Safer Communities Fund Round 3 – Infrastructure Grants
"This Capital Funding Grant Opportunity was announced as part of the broader 2020 Aged Care Approvals Round (ACAR).  Up to $150 million has been made available for capital grants to fund suitable proposals which specifically aim to improve access to quality residential aged care in regional, rural and remote locations and/or improve access to care for any of the Special Needs Groups under the  Aged Care Act 1997 , in any area.    Information about the 2020 ACAR, including guidance materials and application forms for grant funding and aged care places, is available on the Department of Health’s website:  https://www.health.gov.au/initiatives-and-programs/2020-aged-care-approvals-round-acar    If you have any queries in relation to the 2020 ACAR, please email  ACAR@health.gov.au 
 To view the Grant Opportunity Guidelines, please select the red ""GO Documents"" button on the left hand side.","You must be an approved provider of residential aged care under the  Aged Care Act 1997  to be allocated a capital grant. 
 Further eligibility criteria is set out Part 5.1 of the  Aged Care Act 1997  and Part 2 of the Grant Principles 2014. ",,GO2790,101001 - Aged Care,,"Rural, Regional and Other Special Needs Building FundCapital Funding Grant Opportunity"
"The objectives of the Visions of Australia Program are to:   
 - increase access for Australian audiences to exhibitions of quality Australian arts and cultural material, with a particular focus on regional and remote Australia 
 - encourage partnerships between organisations such as museums and galleries, particularly collaboration across the collections sector, to form curatorial partnerships and where appropriate, access to mentoring and skills transfer opportunities 
 There is no funding cap for individual applications. 
 Funding is delivered through two streams: development or touring, supporting costs such as research, design, production, transport, installation and personnel. 
 The Program delivers two funding rounds each year usually closing in March and October. The Minister for the Arts (or his delegate) approves funding under the Program Guidelines. 
 Funding is available through annual or multiyear funding agreements subject to available funds.","To be eligible you must: • be an Australian incorporated organisation • have as your principal purpose the arts and/or cultural heritage (usually defined in the organisation’s Constitution or Articles of Association, and reflected in the Annual Report and Business Plans) • have an active Australian Business Number (ABN) • be registered for the Goods and Services Tax (GST), if required by the Australian Tax Office • not have any outstanding reports, acquittals or serious breaches relating to any Commonwealth funding. Unincorporated groups with an arts or cultural heritage purpose may seek funding but must be auspiced by an organisation that meets the above criteria and applies on their behalf. Individual business units and entities of local government or state government authorities with an arts or cultural heritage purpose (such as art galleries, museums or performing arts centres) are eligible to apply.",VAR10-2020,GO3545,121005 - Museums and Galleries,,Visions of Australia - Round 10
"The PHN Mental Health Supports for Bushfire Affected Australians grant opportunity provides funding to twelve specified PHNs to enable provision of mental health support for individuals, families and communities, including first responders, who have been impacted by the recent bushfire emergency. Details of the funding available for each element of the grant opportunity and the twelve PHNs is at 3.1. 
 The activities in this grant opportunity will contribute to the achievement of the Department of Health’s Portfolio Budget Statement Outcome 2, Health Access and Support Services, specifically Program 2.1 Mental Health.","The grant opportunity will provide funding to the eligible PHNs for activities as outlined in section 5 of the Grant Opportunity Guidelines, depending on severity of the bushfire impact to the region.",,GO4184,231015 - Mental Health,,PHN: Mental Health Bushfire Recovery Grant Opportunity
